id,url,full_description,all_reviews_text,rating_subscores,all_reviews_text_en,clean_reviews,filtered_reviews
205,https://www.booking.com/hotel/fr/paris-cusset-opera.fr.html?aid=304142&label=gen173nr-1FCAQoggJCDHNlYXJjaF9wYXJpc0gzWARoTYgBAZgBDbgBB8gBDNgBAegBAfgBA4gCAagCA7gC96enuwbAAgHSAiQ5ZjEyZmI3YS05ZmIwLTQ3ZmYtYjM4My0yZGZmNDVmZTA5YTHYAgXgAgE&ucfs=1&arphpl=1&group_adults=2&req_adults=2&no_rooms=1&group_children=0&req_children=0&hpos=6&hapos=206&sr_order=popularity&nflt=SustainablePropertyLevelFilter%3D4&srpvid=524095fbb1e5017d&srepoch=1734989145&from_sustainable_property_sr=1&from=searchresults,"Situé au cœur de Paris, à seulement 600 mètres de l'opéra Garnier et des grands magasins Galeries Lafayette, le Mercure Paris Opera Louvre propose des chambres climatisées et élégantes ainsi qu'une connexion Wi-Fi gratuite.

Desservies par un ascenseur, toutes disposent d'une télévision par satellite à écran plat, d'un plateau/bouilloire et d'une salle de bains privative.

Un petit-déjeuner buffet vous sera servi dans la salle à manger du XVIIIe siècle. Vous pourrez déguster une sélection de collations et de boissons dans le confort de votre chambre en faisant appel au service d'étage, disponible de midi à minuit.

Le Mercure Paris Opera Louvre se trouve à quelques pas du musée du Louvre et du jardin des Tuileries. La station de métro Richelieu-Drouot est à 150 mètres de l'hôtel, tandis que la place de la Concorde est accessible en 22 minutes à pied.",,{},,,
206,https://www.booking.com/hotel/fr/paris-stendhal-place-vendome.fr.html?aid=304142&label=gen173nr-1FCAQoggJCDHNlYXJjaF9wYXJpc0gzWARoTYgBAZgBDbgBB8gBDNgBAegBAfgBA4gCAagCA7gC96enuwbAAgHSAiQ5ZjEyZmI3YS05ZmIwLTQ3ZmYtYjM4My0yZGZmNDVmZTA5YTHYAgXgAgE&ucfs=1&arphpl=1&group_adults=2&req_adults=2&no_rooms=1&group_children=0&req_children=0&hpos=7&hapos=207&sr_order=popularity&nflt=SustainablePropertyLevelFilter%3D4&srpvid=524095fbb1e5017d&srepoch=1734989145&from_sustainable_property_sr=1&from=searchresults,"Idéalement situé dans le centre de Paris, l'Hotel Stendhal Place Vendôme Paris - MGallery propose un petit-déjeuner buffet et une connexion Wi-Fi gratuite dans l'ensemble de ses locaux. Cet hôtel 4 étoiles propose un service d'étage et une réception ouverte 24h/24. Vous pourrez profiter d'un bar.

Les chambres climatisées comprennent un bureau, une machine à café, un minibar, un grille-pain, un coffre-fort, une télévision à écran plat et une salle de bains privative avec baignoire. Certaines offrent une vue sur la ville. Toutes les chambres disposent d'une armoire.

Vous séjournerez à proximité de l'opéra Garnier, de la gare Saint-Lazare et du musée du Louvre. L'aéroport de Paris-Orly est implanté à 18 km.",,{},,,
207,https://www.booking.com/hotel/fr/tielyseesfoch.fr.html?aid=304142&label=gen173nr-1FCAQoggJCDHNlYXJjaF9wYXJpc0gzWARoTYgBAZgBDbgBB8gBDNgBAegBAfgBA4gCAagCA7gC96enuwbAAgHSAiQ5ZjEyZmI3YS05ZmIwLTQ3ZmYtYjM4My0yZGZmNDVmZTA5YTHYAgXgAgE&ucfs=1&arphpl=1&group_adults=2&req_adults=2&no_rooms=1&group_children=0&req_children=0&hpos=8&hapos=208&sr_order=popularity&nflt=SustainablePropertyLevelFilter%3D4&srpvid=524095fbb1e5017d&srepoch=1734989145&from_sustainable_property_sr=1&from=searchresults,"Situé à Paris, l'établissement 4 étoiles Le Belgrand Hotel Paris Champs Elysées, Tapestry By Hilton propose un jardin et un bar. Doté d'une terrasse bien exposée, cet établissement se trouve à proximité de la tour Eiffel et du palais des congrès de Paris. Cet établissement non-fumeurs se trouve à moins de 1 km de l'Arc de Triomphe.

Vous disposerez également d'un réfrigérateur.

Un petit-déjeuner buffet, continental ou américain est servi tous les matins sur place.

Le personnel de la réception parle arabe, anglais et espagnol.

Vous séjournerez à 3,1 km du musée de l'Orangerie et à 3,2 km de la gare Saint-Lazare. L'aéroport de Paris-Orly est implanté à 22 km.",,{},,,
